<?xml version="1.0" encoding="UTF-8" ?>
<rows xmlns:xsi="http://www.w3.org/2001/XMLSchema-instance"
    xsi:noNamespaceSchemaLocation="../schema/INSTRUCTORS.xsd">
    <ROW>
        <IDNUMBER>123456789</IDNUMBER>
        <PRIMARY_INSTRUCTOR/>
        <CLASS_DEPT_CODE>TST2</CLASS_DEPT_CODE>
        <CLASS_COURSE_NBR>2010</CLASS_COURSE_NBR>
        <SECTION_NBR>001</SECTION_NBR>
        <INDIV_NAME>1, instructor</INDIV_NAME>
        <PRIMARY_ACCESS_ID>inst1</PRIMARY_ACCESS_ID>
    </ROW>
    <ROW>
        <IDNUMBER>234555</IDNUMBER>
        <PRIMARY_INSTRUCTOR>Y</PRIMARY_INSTRUCTOR>
        <CLASS_DEPT_CODE>TST2</CLASS_DEPT_CODE>
        <CLASS_COURSE_NBR>2010</CLASS_COURSE_NBR>
        <SECTION_NBR>001</SECTION_NBR>
        <INDIV_NAME>2, instructor</INDIV_NAME>
        <PRIMARY_ACCESS_ID>inst2</PRIMARY_ACCESS_ID>
    </ROW>
    <ROW>
        <IDNUMBER>234555</IDNUMBER>
        <PRIMARY_INSTRUCTOR>Y</PRIMARY_INSTRUCTOR>
        <CLASS_DEPT_CODE>Biology</CLASS_DEPT_CODE>
        <CLASS_COURSE_NBR>101c</CLASS_COURSE_NBR>
        <SECTION_NBR>001</SECTION_NBR>
        <INDIV_NAME>2, instructor</INDIV_NAME>
        <PRIMARY_ACCESS_ID>inst2</PRIMARY_ACCESS_ID>
    </ROW>
</rows>
